{
  "id": "f7e8d9c0-b1a2-4536-9d8e-7f6a5b4c3d2e",
  "email": "jean.martin@formateur-pro.fr",
  "first_name": "Jean",
  "last_name": "Martin",
  "phone": "+33 6 98 76 54 32",
  "birthdate": "1978-11-22",
  "language_animation": "Français, Anglais",
  "outside_animation": "Expérience en entreprise, animation équipes distribuées",
  "signed_contract": true,
  "signed_contract_year": 2023,
  "roles": ["trainer", "organizer", "participant"],
  "stripe_customer_id": "cus_PqR5tU8vW0xYzA",
  "billing_address": {
    "street": "45 avenue des Champs-Élysées",
    "street2": null,
    "city": "Paris",
    "postal_code": "75008",
    "region": "Île-de-France",
    "country": "FR"
  },
  "shipping_address": {
    "street": "8 impasse du Moulin",
    "street2": null,
    "city": "Versailles",
    "postal_code": "78000",
    "region": "Île-de-France",
    "country": "FR"
  },
  "status_labels": ["certified_trainer", "expert", "speaker"],
  "tenant_id": "1er-Degré",
  "created_at": "2023-05-10T08:15:00Z",
  "updated_at": "2025-09-20T16:45:00Z"
}
