{
  "id": "a1b2c3d4-e5f6-4a7b-8c9d-0e1f2a3b4c5d",
  "email": "marie.dubois@example.fr",
  "first_name": "Marie",
  "last_name": "Dubois",
  "phone": "+33 6 12 34 56 78",
  "birthdate": "1985-03-15",
  "language_animation": "Français",
  "outside_animation": null,
  "signed_contract": true,
  "signed_contract_year": 2024,
  "roles": ["participant", "volunteer"],
  "stripe_customer_id": "cus_NfD8kG5hW9pQrX",
  "billing_address": {
    "street": "12 rue de la République",
    "street2": "Appartement 3B",
    "city": "Lyon",
    "postal_code": "69002",
    "region": "Auvergne-Rhône-Alpes",
    "country": "FR"
  },
  "shipping_address": {
    "street": "12 rue de la République",
    "street2": "Appartement 3B",
    "city": "Lyon",
    "postal_code": "69002",
    "region": "Auvergne-Rhône-Alpes",
    "country": "FR"
  },
  "status_labels": ["active", "newsletter_subscriber", "early_adopter"],
  "tenant_id": "1er-Degré",
  "created_at": "2024-01-15T10:30:00Z",
  "updated_at": "2024-10-01T14:22:00Z"
}
